<?xml version="1.0" encoding="utf-8" ?>
<xsd:schema xmlns:xsd="http://www.w3.org/2001/XMLSchema"
            targetNamespace="http://www.limmen.kth.se.id2208.hw1.short_cv"
            xmlns="http://www.limmen.kth.se.id2208.hw1.short_cv"
            elementFormDefault="qualified">

    <xsd:annotation>
        <xsd:documentation xml:lang="en">
            This schema defines a short CV for a job-seeker. It contains personal information, skills, degrees and
            previous working experience.
        </xsd:documentation>
    </xsd:annotation>

    <!-- Global main element ShortCV -->
    <xsd:element name="ShortCV">
        <xsd:complexType>
            <xsd:sequence>
                <xsd:element name="PersonalInformation">
                    <xsd:complexType>
                        <xsd:sequence>
                            <xsd:element name="FirstName">
                                <xsd:simpleType>
                                    <xsd:restriction base="xsd:string">
                                        <xsd:minLength value="1"/>
                                    </xsd:restriction>
                                </xsd:simpleType>
                            </xsd:element>
                            <xsd:element name="LastName">
                                <xsd:simpleType>
                                    <xsd:restriction base="xsd:string">
                                        <xsd:minLength value="1"/>
                                    </xsd:restriction>
                                </xsd:simpleType>
                            </xsd:element>
                            <xsd:element name="City" type="xsd:string"/>
                            <xsd:element name="CivicRegistrationNumber">
                                <xsd:simpleType>
                                    <xsd:restriction base="xsd:string">
                                        <xsd:pattern value="\d{6}-\d{4}"/>
                                    </xsd:restriction>
                                </xsd:simpleType>
                            </xsd:element>
                            <xsd:element name="Email">
                                <!-- RegEx for valid email retreived from: http://www.zvon.org/xxl/XMLSchemaTutorial/Output/ser_types_st4.html -->
                                <xsd:simpleType>
                                    <xsd:restriction base="xsd:string">
                                        <xsd:pattern value="[^@]+@[^\.]+\..+"/>
                                    </xsd:restriction>
                                </xsd:simpleType>
                            </xsd:element>
                        </xsd:sequence>
                    </xsd:complexType>
                </xsd:element>
                <xsd:element name="Skills">
                    <xsd:complexType>
                        <xsd:sequence>
                            <xsd:element name="Skill" type="xsd:string" minOccurs="0" maxOccurs="unbounded"/>
                        </xsd:sequence>
                    </xsd:complexType>
                </xsd:element>
                <xsd:element name="Preferences">
                    <xsd:complexType>
                        <xsd:sequence>
                            <xsd:element name="JobInterest" type="xsd:string"/>
                            <xsd:element name="JobType">
                                <xsd:simpleType>
                                    <xsd:restriction base="xsd:string">
                                        <xsd:enumeration value="permanent"/>
                                        <xsd:enumeration value="part time"/>
                                        <xsd:enumeration value="contract"/>
                                        <xsd:enumeration value="consult"/>
                                    </xsd:restriction>
                                </xsd:simpleType>
                            </xsd:element>
                            <xsd:element name="Locations">
                                <xsd:complexType>
                                    <xsd:sequence>
                                        <xsd:element name="Location" type="xsd:string" maxOccurs="unbounded"/>
                                    </xsd:sequence>
                                </xsd:complexType>
                            </xsd:element>
                        </xsd:sequence>
                    </xsd:complexType>
                </xsd:element>
                <xsd:element name="MotivationLetter" type="xsd:string"/>
            </xsd:sequence>
        </xsd:complexType>
    </xsd:element>

</xsd:schema>
